1200;142;TGwZ7MNtBFU;105;Gwen Stefani;144;cool;Circles;circle;8220;__ and triangles;3-4;128690;132410;3720;0;0
1201;148;VdQY7BusJNU;117;Cyndi Lauper;150;time after time;circles;circle;8517;Caught up in __ confusion--;3-4;22050;26770;4720;0;0
1202;152;CcNo07Xp8aQ;132;Robyn;154;dancing on my own;circles;circle;8742;I'm spinning around in __;3-4;111310;115560;4250;0;0
1318;308;j5-yKhDd64s;802;Eminem;318;not afraid;circle;circle;14816;It's a game called __ and I don't know how,;3-4;118270;120670;2400;1;0
1319;309;NlmezywdxPI;802;Eminem;319;survival;circle;circle;14907;Now draw a __ around it and put a line through it slut;3-4;146640;149200;2560;1;0
1385;554;_6Zp84XH6Eo;2465;beck;824;heart is a drum;Circling;circle;44348;__ around your iron will;3-4;25150;32300;7150;0;0
